[
  {
    "claim_id": "TI-20260915-001-C001",
    "fingerprint": "SRC-0010|9e26dc8e87a3303180864ab5b785b7784b02423f093b422507d8e91c99b41498|MED|R:y|D:n|A:n|art:na|meth:na|hedge:na",
    "issue": "TI-20260915-001",
    "first_issue": "TI-20260915-001",
    "citation_count": 1,
    "text": "the September 3, 2026 public release of FalconFlank exploit code and whether CrowdStrike was given advance notice before publication",
    "source_id": "SRC-0010",
    "source_type": "MED",
    "grade": 4,
    "relay_depth": 1,
    "evidentiary_status": "alleged",
    "polarity": "positive",
    "volatility": "durable",
    "language": "en",
    "synthetic": false,
    "gates": {
      "retrievable": true,
      "origin_stated": true,
      "direct_observation": false,
      "aggregate": false,
      "artifact_test": "n/a",
      "method_test": "n/a",
      "hedge_test": "n/a"
    },
    "gate_vector": "MED|R:y|D:n|A:n|art:na|meth:na|hedge:na",
    "segmentation": {
      "atomic_assertions": 1,
      "merged": false,
      "assertions": [
        {
          "key": "A1",
          "descriptor": "the September 3, 2026 public release of FalconFlank exploit code and whether CrowdStrike was given advance notice before publication"
        }
      ]
    },
    "grader": {
      "model": "claude-sonnet-5",
      "spec_version": "4.1",
      "schema_version": 4,
      "normalizer": "html/v1",
      "run": "2026-09-15T12:00:00Z",
      "passes": 1,
      "agreement": "unanimous"
    },
    "hunt_value": {
      "behavioral": true,
      "behavioral_basis": "abuses Falcon Sensor's Office macro remediation to spawn a SYSTEM process",
      "huntable": true,
      "telemetry_classes": [
        "process-execution"
      ],
      "collection_point_basis": "derived",
      "collection_point_source": "endpoint running CrowdStrike Falcon Sensor",
      "indicator_bearing": false
    },
    "sectors": {
      "confirmed": [],
      "contextual": []
    },
    "actors": {
      "subject": [],
      "referenced": [],
      "names_used_by_source": [
        "Nightmare Eclipse"
      ],
      "justified_by": "self-chosen handle credited with the release"
    },
    "assertion_license": {
      "may_assert": "relayed_finding",
      "may_present_as_fact": false,
      "required_form": "name the relay and the named primary; never present as the primary's own words; carries evidentiary status 'alleged' at every hop",
      "attribution_required": true,
      "may_ground_recommendation": true,
      "expires": null
    },
    "entities": {
      "clusters": [],
      "families": [],
      "tools": [
        "FalconFlank",
        "CrowdStrike Falcon Sensor"
      ],
      "campaigns": [],
      "vulnerabilities": [],
      "justified_by": "named PoC and affected product"
    },
    "time": {
      "source_published": "2026-09-04",
      "fetched": "2026-09-15T01:39:55Z"
    },
    "provenance": {
      "pool": "live",
      "capture_is_retrospective": true
    },
    "disposition": "open"
  },
  {
    "claim_id": "TI-20260915-001-C002",
    "fingerprint": "SRC-0054|28f2fa408def642befd0ee4ba66074f9420257dbaea9ae6c2fafca3dc4cc0ea0|MED|R:y|D:n|A:n|art:na|meth:na|hedge:na",
    "issue": "TI-20260915-001",
    "first_issue": "TI-20260915-001",
    "citation_count": 1,
    "text": "the September 3, 2026 public release of FalconFlank exploit code and whether CrowdStrike was given advance notice before publication",
    "source_id": "SRC-0054",
    "source_type": "MED",
    "grade": 4,
    "relay_depth": 1,
    "evidentiary_status": "alleged",
    "polarity": "positive",
    "volatility": "durable",
    "language": "en",
    "synthetic": false,
    "gates": {
      "retrievable": true,
      "origin_stated": true,
      "direct_observation": false,
      "aggregate": false,
      "artifact_test": "n/a",
      "method_test": "n/a",
      "hedge_test": "n/a"
    },
    "gate_vector": "MED|R:y|D:n|A:n|art:na|meth:na|hedge:na",
    "segmentation": {
      "atomic_assertions": 1,
      "merged": false,
      "assertions": [
        {
          "key": "A1",
          "descriptor": "the September 3, 2026 public release of FalconFlank exploit code and whether CrowdStrike was given advance notice before publication"
        }
      ]
    },
    "grader": {
      "model": "claude-sonnet-5",
      "spec_version": "4.1",
      "schema_version": 4,
      "normalizer": "html/v1",
      "run": "2026-09-15T12:00:00Z",
      "passes": 1,
      "agreement": "unanimous"
    },
    "hunt_value": {
      "behavioral": false,
      "huntable": false,
      "telemetry_classes": [],
      "indicator_bearing": false
    },
    "sectors": {
      "confirmed": [],
      "contextual": []
    },
    "actors": {
      "subject": [],
      "referenced": [],
      "names_used_by_source": [
        "Nightmare Eclipse",
        "Chaotic Eclipse",
        "Infinite Nightmare",
        "MSNightmare",
        "Kevin Beaumont"
      ],
      "justified_by": "named discloser and independent verifier"
    },
    "assertion_license": {
      "may_assert": "relayed_finding",
      "may_present_as_fact": false,
      "required_form": "name the relay and the named primary; never present as the primary's own words; carries evidentiary status 'alleged' at every hop",
      "attribution_required": true,
      "may_ground_recommendation": true,
      "expires": null
    },
    "entities": {
      "clusters": [],
      "families": [],
      "tools": [
        "CrowdStrike Falcon"
      ],
      "campaigns": [],
      "vulnerabilities": [],
      "justified_by": "named affected product"
    },
    "time": {
      "observed_period": {
        "start": "2026-09-03",
        "end": "2026-09-03",
        "basis": "derived",
        "precision": "day"
      },
      "source_published": "2026-09-03T19:08:00Z",
      "fetched": "2026-09-15T01:40:06Z"
    },
    "provenance": {
      "pool": "live",
      "capture_is_retrospective": true
    },
    "disposition": "open"
  },
  {
    "claim_id": "TI-20260915-001-C003",
    "fingerprint": "SRC-0054|28f2fa408def642befd0ee4ba66074f9420257dbaea9ae6c2fafca3dc4cc0ea0|MED|R:y|D:y|A:n|art:p|meth:p|hedge:p",
    "issue": "TI-20260915-001",
    "first_issue": "TI-20260915-001",
    "citation_count": 1,
    "text": "the researcher's publicly used aliases and their history of prior vulnerability disclosures against other named vendors",
    "source_id": "SRC-0054",
    "source_type": "MED",
    "grade": 1,
    "relay_depth": 0,
    "evidentiary_status": "observed",
    "polarity": "positive",
    "volatility": "durable",
    "language": "en",
    "synthetic": false,
    "gates": {
      "retrievable": true,
      "origin_stated": true,
      "direct_observation": true,
      "aggregate": false,
      "artifact_test": "pass",
      "method_test": "pass",
      "hedge_test": "pass"
    },
    "gate_vector": "MED|R:y|D:y|A:n|art:p|meth:p|hedge:p",
    "segmentation": {
      "atomic_assertions": 1,
      "merged": false,
      "assertions": [
        {
          "key": "A1",
          "descriptor": "the researcher's publicly used aliases and their history of prior vulnerability disclosures against other named vendors"
        }
      ]
    },
    "grader": {
      "model": "claude-sonnet-5",
      "spec_version": "4.1",
      "schema_version": 4,
      "normalizer": "html/v1",
      "run": "2026-09-15T12:00:00Z",
      "passes": 1,
      "agreement": "unanimous"
    },
    "hunt_value": {
      "behavioral": false,
      "huntable": false,
      "telemetry_classes": [],
      "indicator_bearing": false
    },
    "sectors": {
      "confirmed": [],
      "contextual": []
    },
    "actors": {
      "subject": [],
      "referenced": [],
      "names_used_by_source": [
        "Nightmare Eclipse",
        "Chaotic Eclipse",
        "Infinite Nightmare",
        "MSNightmare"
      ],
      "justified_by": "named aliases"
    },
    "assertion_license": {
      "may_assert": "attributed_observation",
      "may_present_as_fact": false,
      "required_form": "name the source; do not say established, confirmed, or verified",
      "attribution_required": true,
      "may_ground_recommendation": true,
      "expires": null
    },
    "entities": {
      "clusters": [],
      "families": [],
      "tools": [
        "CrowdStrike Falcon",
        "Kaspersky Endpoint Antivirus",
        "Avast Antivirus"
      ],
      "campaigns": [],
      "vulnerabilities": [],
      "justified_by": "named prior targets"
    },
    "time": {
      "source_published": "2026-09-03T19:08:00Z",
      "fetched": "2026-09-15T01:40:06Z"
    },
    "provenance": {
      "pool": "live",
      "capture_is_retrospective": true
    },
    "disposition": "open"
  },
  {
    "claim_id": "TI-20260915-001-C004",
    "fingerprint": "SRC-0031|191c1733106fab6b9c22ee0b387960e72da0c702627605b9dfc465cd90327572|MED|R:y|D:y|A:n|art:f|meth:f|hedge:p",
    "issue": "TI-20260915-001",
    "first_issue": "TI-20260915-001",
    "citation_count": 1,
    "text": "the researcher's publicly used aliases and their history of prior vulnerability disclosures against other named vendors",
    "source_id": "SRC-0031",
    "source_type": "MED",
    "grade": 2,
    "relay_depth": 0,
    "evidentiary_status": "observed",
    "polarity": "positive",
    "volatility": "durable",
    "language": "en",
    "synthetic": false,
    "gates": {
      "retrievable": true,
      "origin_stated": true,
      "direct_observation": true,
      "aggregate": false,
      "artifact_test": "fail",
      "method_test": "fail",
      "hedge_test": "pass"
    },
    "gate_vector": "MED|R:y|D:y|A:n|art:f|meth:f|hedge:p",
    "segmentation": {
      "atomic_assertions": 1,
      "merged": false,
      "assertions": [
        {
          "key": "A1",
          "descriptor": "the researcher's publicly used aliases and their history of prior vulnerability disclosures against other named vendors"
        }
      ]
    },
    "grader": {